{
  "candidates": [
    {
      "classification": "possibly_stale",
      "edit": {
        "find": "new",
        "replace": "SECRET_SENTINEL_DO_NOT_ECHO"
      },
      "evidence_refs": [
        "service.example.port"
      ],
      "hunk_id": "hunk-1",
      "id": "candidate-secret",
      "reason": "possibly_outdated",
      "source": {
        "quote": "new",
        "span_id": "span-1"
      }
    }
  ],
  "document_path": "docs/guides/example.md",
  "kind": "claim_candidates",
  "manifest_sha256": "2cd52e8bc6bdaf59039c568d032ab50660fed2eb4073afeeff2ac72008635125",
  "revision": {
    "base": "aaaaaaaaaaaaaaaaaaaaaaaaaaaaaaaaaaaaaaaa",
    "head": "bbbbbbbbbbbbbbbbbbbbbbbbbbbbbbbbbbbbbbbb"
  },
  "schema_version": 1
}
