{
  "candidates": [],
  "document_path": "docs/guides/other.md",
  "kind": "claim_candidates",
  "manifest_sha256": "2cd52e8bc6bdaf59039c568d032ab50660fed2eb4073afeeff2ac72008635125",
  "revision": {
    "base": "aaaaaaaaaaaaaaaaaaaaaaaaaaaaaaaaaaaaaaaa",
    "head": "bbbbbbbbbbbbbbbbbbbbbbbbbbbbbbbbbbbbbbbb"
  },
  "schema_version": 1
}
