{
  "candidates": [],
  "document_path": "docs/guides/example.md",
  "kind": "claim_candidates",
  "manifest_sha256": "ffffffffffffffffffffffffffffffffffffffffffffffffffffffffffffffff",
  "revision": {
    "base": "aaaaaaaaaaaaaaaaaaaaaaaaaaaaaaaaaaaaaaaa",
    "head": "bbbbbbbbbbbbbbbbbbbbbbbbbbbbbbbbbbbbbbbb"
  },
  "schema_version": 1
}
