{
  "candidates": [
    {
      "classification": "candidate_contradiction",
      "edit": null,
      "evidence_refs": [
        "fabricated.evidence.id"
      ],
      "hunk_id": "hunk-1",
      "id": "candidate-fake",
      "reason": "evidence_conflict",
      "source": {
        "quote": "new",
        "span_id": "span-1"
      }
    }
  ],
  "document_path": "docs/guides/example.md",
  "kind": "claim_candidates",
  "manifest_sha256": "2cd52e8bc6bdaf59039c568d032ab50660fed2eb4073afeeff2ac72008635125",
  "revision": {
    "base": "aaaaaaaaaaaaaaaaaaaaaaaaaaaaaaaaaaaaaaaa",
    "head": "bbbbbbbbbbbbbbbbbbbbbbbbbbbbbbbbbbbbbbbb"
  },
  "schema_version": 1
}
